file_name,uni,wylie,url,dept,grade,char_len,audio_len,path,inf
STT_AB00638_0240_1554554_to_1556848,བདུན་པོ་གང་རུང་ཞིག་ཏུ་རྙེད་དགོས་པ་ལ།  ,bdun po gang rung zhig tu rnyed dgos pa la/__,https://d38pmlk0v88drf.cloudfront.net/wav16k/STT_AB00638_0240_1554554_to_1556848.wav,STT_AB,2,38,2.294,wav16k/STT_AB00638_0240_1554554_to_1556848.wav,བདུན་པོ་གང་རུང་ཞིག་ཏུ་རྙེད་དགོས་པ་ལ།
STT_AB00312_0029_301846_to_313865,འགྲོ་བཞིན་པའི་སྐབས་སུ་ཐལ་རླུང་ཤིན་ཏུ་དྲག་པོ་ཞིག་བརྒྱབས་ནས་ལྷགས་པས་འཁྱེར་ལ་ཉེ་བ་བྱུང་སྟེ་གཅིག་གིས་གཅིག་ལ་འཐམས་ནས་ཡུན་རིང་ཙམ་སྡོད་དགོས་བྱུང་ཞིང་མིག་དང་ཁ་ལ་ཡང་ཐལ་བ་འཚང་སྟེ་མིག་ལྟ་མི་ཐུབ་པ་ཙམ་བྱུང་།  ,'gro bzhin pa'i skabs su thal rlung shin tu drag po zhig brgyabs nas lhags pas 'khyer la nye ba byung ste gcig gis gcig la 'thams nas yun ring tsam sdod dgos byung zhing mig dang kha la yang thal ba 'tshang ste mig lta mi thub pa tsam byung /__,https://d38pmlk0v88drf.cloudfront.net/wav16k/STT_AB00312_0029_301846_to_313865.wav,STT_AB,2,196,12.019,wav16k/STT_AB00312_0029_301846_to_313865.wav,འགྲོ་བཞིན་པའི་སྐབས་སུ་ཐལ་ལུང་ཤིན་ཏུ་དྲག་པོ་ཞིག་བརྒྱབ་ནས་ལྷག་པས་ཁེ་ལ་ཉེ་བ་བྱུང་སྟེ་གཅིག་གིས་གཅིག་ལ་འཐམས་ནས་ཡུན་རིང་ཙམ་སྡོད་དགོས་བྱུང་ཞིང་། མིག་དང་ཁ་ལ་ཡང་ཐལ་བ་ཚང་ཏེ་མིག་ལྟ་མི་ཐུབ་པ་ཙམ་བྱུང་།
STT_AB00312_0030_314530_to_325793,རླུང་བུ་ཅུང་འཇགས་ནས་མུ་མཐུད་ལ་དེའི་གྱེན་དུ་འཛེགས་ཏེ་ལ་རྩེར་མ་སླེབས་ཙམ་ལ་པདྨ་ལྷ་མཛེས་ནི་ལ་དུག་གི་དབང་གི་མགོ་བོ་ན་ཞིང་སྐྱུག་མེར་ལྡང་བ་སོགས་ཀྱིས་གོམ་པ་ཤིན་ཏུ་སྤོ་དཀའ་བར་གྱུར།  ,rlung bu cung 'jags nas mu mthud la de'i gyen du 'dzegs te la rtser ma slebs tsam la pad+ma lha mdzes ni la dug gi dbang gi mgo bo na zhing skyug mer ldang ba sogs kyis gom pa shin tu spo dka' bar gyur/__,https://d38pmlk0v88drf.cloudfront.net/wav16k/STT_AB00312_0030_314530_to_325793.wav,STT_AB,2,173,11.263,wav16k/STT_AB00312_0030_314530_to_325793.wav,རླུང་བོ་ཅུང་འཇངས་ནས་མུ་མཐུད་ལ་དེའི་རྒྱན་དུ་རཛེགས་ཏེ་ལ་རྩེར་མ་སླེབས་ཙམ་ལ་པདྨ་ལྷ་མཛེས་ནི་ལ་དུག་དབང་གིས་མགོ་བོ་ན་ཞིང་སྐྱུག་མིན་ལྡང་བ་སོགས་ཀྱིས་གོམ་པ་ཤིན་ཏུ་སྤོ་དཀའ་བར་གྱུར།
STT_AB00312_0037_390042_to_402800,ལམ་ཁུག་གཅིག་ཏུ་ཆུ་ཆུང་ཆུང་ཞིག་འབབ་ཅིང་གཡས་གཡོན་དུ་རྩྭ་སྔོན་སྐྱེས་པའི་གཤོང་ས་ཆུང་ཆུང་ཞིག་ཡོད་པ་མཐོང་བས་བསྟན་པས་ང་གཉིས་ཕ་གིར་ངལ་གསོ་ཞིག་བྱའོ་ཞེས་བརྗོད་ནས་དེར་ཕྱིན་ཏེ་རྟ་གཉིས་ཀྱི་སྒ་སྲབ་རྣམས་བཤུས་ནས་ ,lam khug gcig tu chu chung chung zhig 'bab cing g.yas g.yon du rtswa sngon skyes pa'i gshong sa chung chung zhig yod pa mthong bas bstan pas nga gnyis pha gir ngal gso zhig bya'o zhes brjod nas der phyin te rta gnyis kyi sga srab rnams bshus nas _,https://d38pmlk0v88drf.cloudfront.net/wav16k/STT_AB00312_0037_390042_to_402800.wav,STT_AB,2,197,12.758,wav16k/STT_AB00312_0037_390042_to_402800.wav,ལམ་ཁུག་གཅིག་ཏུ་ཆུ་ཆུང་ཆུང་་ཞིག་བབ་ཅིང་གཡས་གཡོན་དུ་རྩྭ་སྔོན་པོ་སྐྱེས་པའི་ཤོང་ས་ཆུང་ཆུང་ཞིག་ཡོད་པ་མཐོང་བས་བསྟན་པས་ང་གཉིས་ཕ་གིར་ངལ་གསོ་ཞིག་བྱས་དོ་ཞེས་བརྗོད་ནས་དེར་ཕྱིན་ཏེ་རྟ་གཉིས་ཀྱི་དགའ་གསབ་རྣམས་བཤུས་ནས་
STT_AB00312_0034_358127_to_368578,ཡིན་ཞེས་བཤད་ནས་ཡར་སྐྱོར་ཏེ་གོམ་པ་རེ་ལ་ངལ་གསོ་རེ་བྱས་ནས་ཕྱིན་ཏེ་ལ་རྩེ་བརྒལ་ནས་མར་ཙམ་བབས་ཐུབ་ཙམ་བྱུང་བས་རིམ་པས་དྲག་ཏུ་སོང་སྟེ་ལ་སྐེད་ཙམ་ལ་སླེབས་སྐབས་གཞི་ནས་ ,yin zhes bshad nas yar skyor te gom pa re la ngal gso re byas nas phyin te la rtse brgal nas mar tsam babs thub tsam byung bas rim pas drag tu song ste la sked tsam la slebs skabs gzhi nas _,https://d38pmlk0v88drf.cloudfront.net/wav16k/STT_AB00312_0034_358127_to_368578.wav,STT_AB,2,155,10.451,wav16k/STT_AB00312_0034_358127_to_368578.wav,ཞེས་བཤད་ནས་ཡར་སྐྱོར་ཏེ་གོམ་པ་རེད་ལ་ངལ་གསོ་རེ་བྱས་ནས་ཕྱིན་ཏེ་ལ་རྩེ་བརྒྱལ་ནས་མར་ཙམ་བབ་ཐུབ་ཙམ་བྱུང་བས་རིམ་པས་དྲག་ཏུ་སོང་སྟེ་ལ་སྐེག་ཙམ་ལ་སླེབས་སྐབས་གཞི་ནས་
STT_AB00312_0035_368578_to_379029,མགོའི་ན་ཚ་འཇགས་ཤིང་བདེ་ཉམས་ཤར། ལ་གཤམ་དུ་མ་སླེབས་ཙམ་ལ་སླར་ཡང་ཆར་རླུང་དྲག་པོ་ཞིག་ལྡང་སྟེ་གོམ་པ་སྤོ་དཀའ་བ་བྱུང་བས་བསྟན་པ་ནི་ལག་ཡ་གཅིག་གིས་རྟ་ཁྲིད། ཡ་གཅིག་གིས་པདྨ་ ,mgo'i na tsha 'jags shing bde nyams shar/_la gsham du ma slebs tsam la slar yang char rlung drag po zhig ldang ste gom pa spo dka' ba byung bas bstan pa ni lag ya gcig gis rta khrid/_ya gcig gis pad+ma _,https://d38pmlk0v88drf.cloudfront.net/wav16k/STT_AB00312_0035_368578_to_379029.wav,STT_AB,2,160,10.451,wav16k/STT_AB00312_0035_368578_to_379029.wav,སྒོའི་ན་ཚ་འཇགས་ཤིང་བདེ་ཉམས་བཞག། ལག་གཤམ་དུ་མ་སླེབས་ཙམ་ལ་སླར་ཡང་ཆ་རླུང་དྲག་པོ་ཞིག་བཏང་སྟེ་གོམ་པ་སྤོ་དཀའ་བ་བྱུང་བས་བསྟན་པ་ནི་ལག་ཡ་གཅིག་གི་རྟ་ཁྲིད། ཡ་གཅིག་གི་པད་
STT_AB00551_0019_122534_to_125469,ཕོ་བྲང་ནང་གི་བསམ་ཚུལ་མི་མཐུན་པའི་འགལ་བ་འདི་དག་ནི།  ,pho brang nang gi bsam tshul mi mthun pa'i 'gal ba 'di dag ni/__,https://d38pmlk0v88drf.cloudfront.net/wav16k/STT_AB00551_0019_122534_to_125469.wav,STT_AB,2,51,2.935,wav16k/STT_AB00551_0019_122534_to_125469.wav,ཕོ་བྲང་ནང་གི་བསམ་ཚུལ་མི་མཐུན་པའི་འགལ་བ་འདི་དག་ནི།
STT_AB00312_0040_428314_to_441072,ཕྱི་ཆར་རླུང་གི་ཁྲོད་དུ་དཀའ་སྡུག་གི་འཚོ་བ་ཉིན་གཅིག་ཀྱང་སྐྱེལ་མྱོང་མེད་པས་སྐབས་དེར་ཐལ་རླུང་དང་ཆར་དྲག་གི་འོག་ཏུ་དཀའ་སྡུག་བཟོད་དཀའ་བའི་དབང་གིས་ཁ་བུབ་ཏུ་ཉལ་ནས་སྨྲེ་ངག་འདོན་བཞིན་བསྡད། དེ་ ,phyi char rlung gi khrod du dka' sdug gi 'tsho ba nyin gcig kyang skyel myong med pas skabs der thal rlung dang char drag gi 'og tu dka' sdug bzod dka' ba'i dbang gis kha bub tu nyal nas smre ngag 'don bzhin bsdad/_de _,https://d38pmlk0v88drf.cloudfront.net/wav16k/STT_AB00312_0040_428314_to_441072.wav,STT_AB,2,182,12.758,wav16k/STT_AB00312_0040_428314_to_441072.wav,ཕྱིར་ཆ་རླུང་གི་ཁྲོད་དུ་དཀའ་སྡུག་གི་འཚོ་བ་ཉིན་གཅིག་ཀྱང་བསྐྱོན་མྱོང་མེད་པས། སྐབས་དེར་ཐལ་ལུང་དང་ཆ་ཧྲག་གི་འོག་ཏུ་དཀའ་སྡུག་བཟོད་དཀའ་བའི་དབང་གིས་ཁ་སྦུབ་ཏུ་ཉལ་ནས་སྨྲེ་ངགས་བཏོན་བཞིན་བསྡད། དེ་
STT_AB00312_0039_415557_to_428314,ཏེ་ལུས་ཀྱི་ཆ་ཤས་ནི་མཆན་ཁུང་འོག་ཁོ་ན་ལས་སྐམ་པ་ཞིག་མེད་པས་གོས་རྣམས་ཕུད་ནས་ཉི་མར་བཀྲམ། པདྨ་ལྷ་མཛེས་ནི་ནང་དུ་སྡོད་སྐབས་འཇམ་པོ་ལུས་ལ་གྱོན། འབོལ་པོ་གདན་ལ་བཏིང་། ཞིམ་པོ་ཁ་ལ་བཟས་ནས་སྡོད་མཁན་ཞིག་ཡིན་པ་ལས་ ,te lus kyi cha shas ni mchan khung 'og kho na las skam pa zhig med pas gos rnams phud nas nyi mar bkram/_pad+ma lha mdzes ni nang du sdod skabs 'jam po lus la gyon/_'bol po gdan la bting /_zhim po kha la bzas nas sdod mkhan zhig yin pa las _,https://d38pmlk0v88drf.cloudfront.net/wav16k/STT_AB00312_0039_415557_to_428314.wav,STT_AB,2,196,12.757,wav16k/STT_AB00312_0039_415557_to_428314.wav,ྟེ་ལུས་ཀྱི་ཆ་ཤས་ནི་མཆན་གོང་འོག་ཁོ་ན་ལས་སྐམ་པ་ཞིག་མེད་པས་གོས་རྣམས་ཕུད་ནས་ཉི་མར་བཀྲམ། པདྨ་ལྷ་མཛེས་ནི་ནང་དུ་སྡོད་སྐབས་འཇམ་པོ་ལུས་ལ་དགོན། འབོལ་པོ་གདན་ལ་བཏིང་། ཞིམ་པོ་ཁ་ལ་བཟས་ནས་སྡོད་མཁན་ཞིག་ཡིན་པ་ལས་
STT_AB00312_0042_453829_to_466587,ཟེར་བ་ནང་བཞིན་སྐབས་རེ་སྐྱིད་པོ་དང་སྐབས་རེ་སྡུག་པོ་ཡོང་བ་དེ་ནི་ཆོས་ཉིད་རེད། འཁོར་བ་སྡུག་བསྔལ་གྱི་རང་བཞིན་ཡིན་ཙང་སྡུག་བསྔལ་མེད་པའི་འཁོར་བ་ཞིག་ག་བ་ཡོད་རེད། ད་ལྟའི་སྡུག་བསྔལ་འདི་ཡང་ང་གཉིས་ཀྱིས་ཚེ་རབས་སྔ་མ་རྣམས་སུ་བསགས་པའི་ལས་ཀྱི་ ,zer ba nang bzhin skabs re skyid po dang skabs re sdug po yong ba de ni chos nyid red/_'khor ba sdug bsngal gyi rang bzhin yin tsang sdug bsngal med pa'i 'khor ba zhig ga ba yod red/_da lta'i sdug bsngal 'di yang nga gnyis kyis tshe rabs snga ma rnams su bsags pa'i las kyi _,https://d38pmlk0v88drf.cloudfront.net/wav16k/STT_AB00312_0042_453829_to_466587.wav,STT_AB,2,226,12.758,wav16k/STT_AB00312_0042_453829_to_466587.wav,ཟེར་བ་ནང་བཞིན་སྐབས་རེ་སྐྱིད་པོ་དང་སྐབས་རེ་སྡུག་པོ་ཡོང་བ་དེ་ནི་ཆོས་ཉིད་རེད། འཁོར་བ་སྡུག་བསྔལ་གྱི་རང་བཞིན་ཡིན་ཙང་སྡུག་བསྔལ་མེད་པའི་འཁོར་བ་ཞིག་ག་བར་ཡོད་རེད། ད་ལྟའི་སྡུག་བསྔལ་དེ་ཡང་ང་གཉིས་ཀྱི་ཚེ་རབས་སྔ་མ་རྣམས་སུ་བསགས་པའི་ལས་ཀྱི་
STT_AB00312_0088_968779_to_975554,མཐར་མི་ཞིག་གིས་ཁང་པ་ཞིག་གི་སྒོ་ལ་མཛུབ་མོ་བཙུགས་ཏེ་སྒོ་དམར་པོ་ཉི་ཟླའི་རི་མོས་བརྒྱན་པ་དེ་རེད་ཅེས་བཤད།  ,mthar mi zhig gis khang pa zhig gi sgo la mdzub mo btsugs te sgo dmar po nyi zla'i ri mos brgyan pa de red ces bshad/__,https://d38pmlk0v88drf.cloudfront.net/wav16k/STT_AB00312_0088_968779_to_975554.wav,STT_AB,2,101,6.775,wav16k/STT_AB00312_0088_968779_to_975554.wav,མཐར་མི་ཞིག་གིས་ཁང་པ་ཞིག་གི་སྒོ་ལ་མཛུབ་མོ་བཙུགས་ཏེ་སགོ་དམར་པོ་ཉིན་ཟྟའི་རི་མོས་རྒན་པ་དེ་རེད་ཅེས་བཤད།
STT_AB00319_3262_9364411_to_9368626,རྣ་བའང་དེ་བཞིན་གསུམ་དག་ནི། ཐམས་ཅད་རང་གི་ས་པ་ཉིད།  ,rna ba'ang de bzhin gsum dag ni/_thams cad rang gi sa pa nyid/__,https://d38pmlk0v88drf.cloudfront.net/wav16k/STT_AB00319_3262_9364411_to_9368626.wav,STT_AB,2,50,4.215,wav16k/STT_AB00319_3262_9364411_to_9368626.wav,རྣ་བའང་དེ་བཞིན་གསུང་དག་ནི། ཐམས་ཅད་རང་གི་ས་པ་ཉིད།
STT_AB00551_0015_98412_to_109001,ཏེ། དར་མ་འུ་དུམ་བཙན་ལ་རྒྱབ་སྐྱོར་བྱེད་ཀྱི་ཡོད་ལ། དར་མ་འུ་དུམ་བཙན་པོས་ཀྱང་རྒྱབ་སྐྱོར་བྱེད་པའི་བློན་པོ་ཚོའི་རེ་འདུན་ལྟར། རང་ཉིད་རྒྱལ་པོ་བྱེད་འདོད་ཡོད་པའི་རྣམ་འགྱུར་ ,te/_dar ma 'u dum btsan la rgyab skyor byed kyi yod la/_dar ma 'u dum btsan pos kyang rgyab skyor byed pa'i blon po tsho'i re 'dun ltar/_rang nyid rgyal po byed 'dod yod pa'i rnam 'gyur _,https://d38pmlk0v88drf.cloudfront.net/wav16k/STT_AB00551_0015_98412_to_109001.wav,STT_AB,2,163,10.589,wav16k/STT_AB00551_0015_98412_to_109001.wav,ཏེ།དར་མ་འུ་དུམ་བཙན་ལ་རྒྱབ་སྐྱོར་བྱེད་ཀྱི་ཡོད་ལ། དར་མ་འུ་དུམ་བཙན་པོས་ཀྱང་རྒྱབ་སྐྱོར་བྱེད་པའི་བློན་པོ་ཚོའི་རེ་འདུན་ལྟར་རང་ཉིད་རྒྱལ་པོ་བྱེད་འདོད་ཡོད་པའི་རྣམ་འགྱུར་
STT_AB00312_0043_466587_to_479344,འབྲས་བུ་ཡིན་ཙང་སྡུག་བསྔལ་བྱུང་ན་ལས་ངན་བྱས་པའི་སྡིག་པ་དེ་ག་དག་འགྲོ་གི་ཡོད་རེད། བྱས་ཙང་དགའ་ཚོར་བྱེད་དགོས་པ་ལས་སྡུག་བསྔལ་བྱེད་མི་རུང་། ད་ཡིན་ནི་ཇ་ཡང་འཁོལ་སོང་ལ་ཇ་འདི་ནི་སྔར་འཐུང་མ་མྱོང་བའི་ཇ་ཞིམ་པོ་ཞིག་འདུག་ཡར་བཞེངས་ ,'bras bu yin tsang sdug bsngal byung na las ngan byas pa'i sdig pa de ga dag 'gro gi yod red/_byas tsang dga' tshor byed dgos pa las sdug bsngal byed mi rung /_da yin ni ja yang 'khol song la ja 'di ni sngar 'thung ma myong ba'i ja zhim po zhig 'dug yar bzhengs _,https://d38pmlk0v88drf.cloudfront.net/wav16k/STT_AB00312_0043_466587_to_479344.wav,STT_AB,2,214,12.757,wav16k/STT_AB00312_0043_466587_to_479344.wav,འབྲས་བུ་ཡིན་ཙང་སྡུག་བསྔལ་བྱུང་ན་ལས་ངན་བྱས་པའི་སྡིག་པ་འདི་གས་དག་འགྲོ་གི་ཡོད་རེད། བྱས་ཙང་དགའ་ཚོར་བྱེད་དགོས་པ་ལས་སྡུག་བསྔལ་བྱེད་མི་རུང་། ད་ཡིན་ན་ཇ་ཡང་གོས་སོང་ལ་ཇ་དེ་ནི་སྔར་ཐུག་མ་མྱོང་བའི་ཇ་ཞིམ་པོ་ཞིག་འདུག ཡར་ཞང
STT_AB00312_0044_479344_to_492101,ལ་ཇ་གང་བཞེས་དང་ཞེས་བརྗོད་བཞིན་དུ་དཔུང་པ་ནས་བཟུང་སྟེ་ཡར་བསླངས་པས་པདྨ་ལྷ་མཛེས་ཀྱང་བསྟན་པའི་བྱེད་བབ་དང་ངག་འཇམ་ཞིང་བྱམས་བརྩེའི་རྣམ་འགྱུར་དེས་སེམས་ལ་དྲོ་སྐྱིད་ཀྱི་ཚོར་བ་ཞིག་བྱུང་ནས་ཇ་གང་བཏུང་།  ,la ja gang bzhes dang zhes brjod bzhin du dpung pa nas bzung ste yar bslangs pas pad+ma lha mdzes kyang bstan pa'i byed bab dang ngag 'jam zhing byams brtse'i rnam 'gyur des sems la dro skyid kyi tshor ba zhig byung nas ja gang btung /__,https://d38pmlk0v88drf.cloudfront.net/wav16k/STT_AB00312_0044_479344_to_492101.wav,STT_AB,2,189,12.757,wav16k/STT_AB00312_0044_479344_to_492101.wav,བཅས་ཇ་གང་ཞེས་དང་ཞེས་བརྗོད་བཞིན་དུ་དཔུང་པ་ནས་བཟུང་སྟེ་ཡར་བླངས་པས་ པདྨ་ལྷ་མཛེས་ཀྱང་བསྟན་པའི་བྱེད་བབ་དང་ངག་འཇམ་ཞིང་བྱམས་བརྩེའི་རྣམ་འགྱུར་དེས་སེམས་ལ་དྲོ་སྐྱིད་ཀྱི་ཚོ་བ་ཞིག་བཅུག་ནས་ཇ་གང་བཏུངས།
STT_AB00312_0076_843271_to_854677,གང་དྲག་གི་བསམ་བློ་གཏོང་བཞིན་པའི་སྐབས་དེར་ནད་པ་དེས་སྐྱུག་པ་ཤུགས་ཆེན་པོ་ཞིག་བསྐྱུགས་ནས་ན་ཟུག་ཅུང་ཟད་ཆུང་དུ་སོང་བ་ལྟ་བུར་གྱུར་ཏེ་ཡར་ལངས་ནས་བསྟན་པར་སྨྲས་པ། དྲིན་ཅན་ཐུགས་ཁྲལ་གནང་མི་དགོས་ ,gang drag gi bsam blo gtong bzhin pa'i skabs der nad pa des skyug pa shugs chen po zhig bskyugs nas na zug cung zad chung du song ba lta bur gyur te yar langs nas bstan par smras pa/_drin can thugs khral gnang mi dgos _,https://d38pmlk0v88drf.cloudfront.net/wav16k/STT_AB00312_0076_843271_to_854677.wav,STT_AB,2,182,11.406,wav16k/STT_AB00312_0076_843271_to_854677.wav,ྲག་གང་དྲག་གི་བསམ་བློ་གཏོང་བཞིན་པའི་སྐབས་དེར་ནད་པ་དེས་སྐྱུག་པོ་ཆེན་པོ་ཞིག་སྐྱུགས་ནས་ན་ཟུག་ཅུང་ཟད་ཆུང་དུ་སོང་བ་ལྟ་བུར་གྱུར་ཏེ་ཡར་ལངས་ནས་བརྟན་པར་སྨྲས་པ། དྲིན་ཅན། ཐུགས་ཁྲལ་གནང་མི་དགོས།
STT_AB00312_0045_492101_to_504859,དེ་ནས་ཡང་བསྟན་པས་ཐང་ཁུག་གི་ནང་དུ་ཕྱུར་ཞིབ་དང་། མར། བྱེ་མ་ཀ་ར་བཅས་བརྒྱབས་ནས་སྤགས་གཡོས་ཏེ་སྤགས་དག་གོང་གཅིག་བཟོས་ནས་སྤགས་འདི་ཞིམ་པོ་ཞིག་ཡོད་ཙང་དག་གོང་གཅིག་རང་བཞེས་དང་ཞེས་ལག་ཏུ་སྤྲད་པས་ ,de nas yang bstan pas thang khug gi nang du phyur zhib dang /_mar/_bye ma ka ra bcas brgyabs nas spags g.yos te spags dag gong gcig bzos nas spags 'di zhim po zhig yod tsang dag gong gcig rang bzhes dang zhes lag tu sprad pas _,https://d38pmlk0v88drf.cloudfront.net/wav16k/STT_AB00312_0045_492101_to_504859.wav,STT_AB,2,182,12.758,wav16k/STT_AB00312_0045_492101_to_504859.wav,དེ་ནས་ཡང་བསྟན་པས་ཐང་ཁུག་གི་ནང་དུ་ཕྱུར་ཞིབ་དང་། མར་བྱེ་མ་ཀ་ར་བཅས་བརྒྱབ་ནས་སྤགས་ཡོད་དེ་སྤགས་དག་གོང་གཅིག་ཏུ་གསོས་ནས་སྤགས་དེ་ཞིམ་པོ་ཞིག་ཡོད་ཙང་ད་གོང་གཅིག་རང་གཅིག་བཞེས་དང་ཞེས་ལག་ཏུ་སྤྲད་པས་
STT_AB00312_0056_622044_to_633475,སྤྱང་ཀིའི་སྐད་ཡང་ཡང་ཐོས་པས་པདྨ་ལྷ་མཛེས་ནི་ཤིན་ཏུ་འཇིགས་ནས་བསྟན་པ་ལགས་ང་ཚོ་སྤྱང་ཀིས་ཟ་གི་མ་རེད་པ་ཞེས་བཤད་པར། བསྟན་པས་ཟ་ཡི་མ་རེད། ཞེད་སྣང་བྱེད་དགོས་མ་རེད། སྤྱང་ཀི་མེ་ ,spyang ki'i skad yang yang thos pas pad+ma lha mdzes ni shin tu 'jigs nas bstan pa lags nga tsho spyang kis za gi ma red pa zhes bshad par/_bstan pas za yi ma red/_zhed snang byed dgos ma red/_spyang ki me _,https://d38pmlk0v88drf.cloudfront.net/wav16k/STT_AB00312_0056_622044_to_633475.wav,STT_AB,2,165,11.431,wav16k/STT_AB00312_0056_622044_to_633475.wav,སྤྱང་ཀིའི་སྐད་ཡང་ཡང་ཐོས་པས་པདྨ་ལྷ་མཛེས་ནི་ཤིན་ཏུ་འཇིགས་ནས་བསྟན་པ་ལགས་ ང་ཚོ་སྤྱང་ཀིས་ཟ་གི་མ་རེད་པ་ཞེས་བཤད་པར་བསྟན་པས་ཟ་གི་མ་རེད། ཞེད་སྣང་བྱེད་དགོས་མ་རེད། སྤྱང་ཀི་མེད་
STT_AB00312_0047_517616_to_530374,ཇ་ཐང་དང་སྤགས་ཞིམ་པོ་འདི་འདྲས་ཡོད་པ་ཡིན་ན་ནང་ལ་སྡོད་དུས་རྟག་པ་མི་ཟ་བ་ག་རེ་ཡིན་ན་ཞེས་དྲིས། བསྟན་པས་དེ་རིང་ཁྱེད་རང་ཁ་སྐོམ་ཡོད་རེད་ལ་གྲོད་ཁོག་ལྟོགས་ཡོད་རེད་དེ་དང་སྐབས་འཁེལ་ཙང་ཇ་ཐང་དང་སྤགས་ཞིམ་ ,ja thang dang spags zhim po 'di 'dras yod pa yin na nang la sdod dus rtag pa mi za ba ga re yin na zhes dris/_bstan pas de ring khyed rang kha skom yod red la grod khog ltogs yod red de dang skabs 'khel tsang ja thang dang spags zhim _,https://d38pmlk0v88drf.cloudfront.net/wav16k/STT_AB00312_0047_517616_to_530374.wav,STT_AB,2,189,12.758,wav16k/STT_AB00312_0047_517616_to_530374.wav,ཇ་ཐང་དང་སྤགས་ཞིམ་པོ་དེ་འདྲས་ཡོད་པ་ཡིན་ན་ ནང་ལ་བསྡད་དུས་རྟག་པར་མི་ཟ་བ་ག་རེ་ཡིན་ནམ་ཞེས་དྲིས། བསྟན་པས་དེ་རིང་ཁྱེད་རང་ཁ་སྐོམ་ཡོད་རེད་ལ་གྲོད་ཕོར་ལྟོགས་ཡོད་རེད། དེ་དང་སྐབས་འགྱེལ་ཙང་ཇ་ཐང་དང་སྤགས་ཞིམ་
